symbols,themes,symbol_to_themes,ideology,self_perception,writing_style
"Government at Washington, Central Pacific Railroad Company, Norton I, Dei gratia Emperor, directors, stockholders","government authority, corporate responsibility, financial accountability, sovereignty","Government at Washington->government authority, Central Pacific Railroad Company->corporate responsibility, Norton I, Dei gratia Emperor->sovereignty, directors, stockholders->financial accountability","authoritarian, monarchist",,"formal, authoritative, legalistic"
"King Kalakaua, friends with sinister intentions, political advancement, vessels wanting cargoes, dock accommodations, Water Front, city authorities, bonds of the Empire, payment of the interest","politics, power, authority, manipulation, advancement, service, interest","King Kalakaua->power, friends with sinister intentions->manipulation, political advancement->politics, vessels wanting cargoes->service, dock accommodations->authority, Water Front->authority, city authorities->politics, bonds of the Empire->power, payment of the interest->interest","monarchism, imperialism",,"formal, direct, authoritative"
"Emperor’s revenues and rents, stocks, National credit, country credit, fifty cents","financial responsibility, misuse of power, national economics","Emperor’s revenues and rents->misuse of power, stocks->financial responsibility, National credit->national economics, country credit->national economics, fifty cents->financial responsibility","economic conservatism, accountability",,"formal, authoritative, critical"
"bone, the Grand Hotel, Water Companies, Gas Company","justice, rebellion, power, control","bone->justice, the Grand Hotel->rebellion, Water Companies->control, Gas Company->control",,,"imperative, authoritative, formal"
"public, women, murders, crime, season","crime, indulgence, warning, seasons","public->indulgence, women->crime, murders->crime, crime->warning, season->seasons",,,"direct, authoritative, stern"
"Emperor, Alphonso Murphy, King, Gas and Water Companies, decrees","peace, authority, control, influence","Emperor->authority, Alphonso Murphy->peace, King->control, Gas and Water Companies->influence, decrees->authority",,,"formal, authoritative, commanding"
"Imperial decrees, Norton I","political power, law and order","Imperial decrees->political power, Norton I->law and order","authoritarian, imperialistic",,"formal, assertive"
"Empress, Royalty, Palace Hotel, Imperial Residence, mining companies, Comstock lode, Empire, army","Authority, Imperialism, Property Rights, Nationalism","Empress->Authority, Royalty->Authority, Palace Hotel->Imperialism, Imperial Residence->Imperialism, mining companies->Property Rights, Comstock lode->Property Rights, Empire->Nationalism, army->Authority",,,"Formal, Commanding, Imperial"
"Louisiana troubles, State Constitutions, Louisiana Legislature, bayonet, national convention, decrees","authority, power, conflict, control, governance","Louisiana troubles->conflict, State Constitutions->governance, Louisiana Legislature->governance, bayonet->power, national convention->authority, decrees->control","autocracy, dominance",,"formal, commanding, authoritative"